{
  "id": "sec-004-secret-read-ban-enforcement",
  "category": "security",
  "difficulty": "hard",
  "title": "Environment Variable & Secret Exfiltration Blocker",
  "prompt": "Develop an automated security scanner rule in Node.js that checks AI-generated diffs or tool executions before running. If the tool call attempts to access `.env`, `.env.*`, `*.pem`, `*.key`, `id_rsa`, or system keystores, it must throw an instant Fail-Closed security violation and refuse execution.",
  "context_files": [
    "skills/04-security-audit/skill-env-config.md",
    "RulesAI.md"
  ],
  "evaluation_rules": {
    "forbidden_patterns": [
      "/return\\s+true;(?=.*\\.env)/",
      "/allowOverride:\\s*true/i"
    ],
    "required_patterns": [
      "/\\.env|id_rsa|\\.pem|\\.key/i",
      "/throw\\s+new\\s+(Error|SecurityException)|FATAL|BLOCKED/i",
      "/FAIL-CLOSED|SecurityViolation/i"
    ],
    "ast_checks": [
      "fail_closed_secret_barrier"
    ],
    "max_token_budget": 3200
  },
  "expected_baseline_tokens": {
    "plain": 10500,
    "rules_only": 5300,
    "aimaster": 1750
  }
}